Sheet: 2
A1: precinct | B1: registered_voters | C1: total_votes | D1: Voter Turnout | E1: election_day_yes | F1: absentee_mail_yes | G1: advance_in_person_1_yes | H1: advance_in_person_2_yes | I1: provisional_yes | J1: votes_yes | K1: election_day_no | L1: absentee_mail_no | M1: advance_in_person_1_no | N1: advance_in_person_2_no | O1: provisional_no | P1: votes_no
A2: HARBINS A | B2: 6353 | C2: 1012 | D2: =RC[-1]/RC[-2] -> 0.1592948213442468 | E2: 173 | F2: 7 | G2: 84 | H2: 89 | I2: 2 | J2: 355 | K2: 324 | L2: 5 | M2: 165 | N2: 161 | O2: 2 | P2: 657
A3: ROCKBRIDGE A | B3: 3763 | C3: 533 | D3: =RC[-1]/RC[-2] -> 0.14164230667020994 | E3: 185 | F3: 2 | G3: 11 | H3: 97 | I3: 4 | J3: 299 | K3: 136 | L3: 7 | M3: 8 | N3: 74 | O3: 9 | P3: 234
A4: DACULA | B4: 4574 | C4: 709 | D4: =RC[-1]/RC[-2] -> 0.15500655881066899 | E4: 151 | F4: 4 | G4: 112 | H4: 23 | I4: 0 | J4: 290 | K4: 223 | L4: 3 | M4: 160 | N4: 31 | O4: 2 | P4: 419
A5: SUWANEE A | B5: 1605 | C5: 227 | D5: =RC[-1]/RC[-2] -> 0.14143302180685358 | E5: 83 | F5: 4 | G5: 2 | H5: 42 | I5: 0 | J5: 131 | K5: 56 | L5: 2 | M5: 0 | N5: 38 | O5: 0 | P5: 96
A6: BAYCREEK A | B6: 2615 | C6: 657 | D6: =RC[-1]/RC[-2] -> 0.25124282982791585 | E6: 144 | F6: 1 | G6: 1 | H6: 81 | I6: 0 | J6: 227 | K6: 288 | L6: 11 | M6: 6 | N6: 125 | O6: 0 | P6: 430
A7: GOODWINS A | B7: 3659 | C7: 668 | D7: =RC[-1]/RC[-2] -> 0.18256354195135283 | E7: 206 | F7: 5 | G7: 19 | H7: 103 | I7: 0 | J7: 333 | K7: 242 | L7: 7 | M7: 9 | N7: 77 | O7: 0 | P7: 335
A8: DULUTH A | B8: 4730 | C8: 947 | D8: =RC[-1]/RC[-2] -> 0.20021141649048627 | E8: 323 | F8: 8 | G8: 159 | H8: 71 | I8: 1 | J8: 562 | K8: 246 | L8: 10 | M8: 75 | N8: 53 | O8: 1 | P8: 385
A9: DUNCANS A | B9: 4403 | C9: 915 | D9: =RC[-1]/RC[-2] -> 0.20781285487167839 | E9: 152 | F9: 1 | G9: 87 | H9: 23 | I9: 0 | J9: 263 | K9: 400 | L9: 7 | M9: 205 | N9: 39 | O9: 1 | P9: 652
A10: PUCKETTS A | B10: 5047 | C10: 958 | D10: =RC[-1]/RC[-2] -> 0.18981573211808994 | E10: 135 | F10: 7 | G10: 99 | H10: 2 | I10: 0 | J10: 243 | K10: 359 | L10: 18 | M10: 317 | N10: 20 | O10: 1 | P10: 715
A11: CATES A | B11: 2274 | C11: 534 | D11: =RC[-1]/RC[-2] -> 0.23482849604221637 | E11: 100 | F11: 11 | G11: 5 | H11: 57 | I11: 1 | J11: 174 | K11: 213 | L11: 15 | M11: 8 | N11: 120 | O11: 4 | P11: 360
A12: BERKSHIRE A | B12: 2329 | C12: 333 | D12: =RC[-1]/RC[-2] -> 0.14297981966509232 | E12: 132 | F12: 2 | G12: 47 | H12: 13 | I12: 0 | J12: 194 | K12: 108 | L12: 2 | M12: 17 | N12: 12 | O12: 0 | P12: 139
A13: BERKSHIRE B | B13: 5250 | C13: 656 | D13: =RC[-1]/RC[-2] -> 0.12495238095238095 | E13: 220 | F13: 3 | G13: 205 | H13: 11 | I13: 2 | J13: 441 | K13: 89 | L13: 8 | M13: 108 | N13: 9 | O13: 1 | P13: 215
A14: DUNCANS C | B14: 2902 | C14: 515 | D14: =RC[-1]/RC[-2] -> 0.17746381805651276 | E14: 110 | F14: 5 | G14: 33 | H14: 8 | I14: 1 | J14: 157 | K14: 240 | L14: 2 | M14: 107 | N14: 9 | O14: 0 | P14: 358
A15: GARNERS A | B15: 3368 | C15: 962 | D15: =RC[-1]/RC[-2] -> 0.28562945368171022 | E15: 203 | F15: 3 | G15: 118 | H15: 7 | I15: 1 | J15: 332 | K15: 383 | L15: 8 | M15: 206 | N15: 30 | O15: 3 | P15: 630
A16: LAWRENCEVILLE A | B16: 3409 | C16: 625 | D16: =RC[-1]/RC[-2] -> 0.18333822235259606 | E16: 118 | F16: 7 | G16: 5 | H16: 145 | I16: 0 | J16: 275 | K16: 145 | L16: 7 | M16: 9 | N16: 189 | O16: 0 | P16: 350
A17: LAWRENCEVILLE B | B17: 4718 | C17: 777 | D17: =RC[-1]/RC[-2] -> 0.16468842729970326 | E17: 206 | F17: 5 | G17: 6 | H17: 185 | I17: 1 | J17: 403 | K17: 210 | L17: 8 | M17: 7 | N17: 149 | O17: 0 | P17: 374
A18: MARTINS A | B18: 3171 | C18: 273 | D18: =RC[-1]/RC[-2] -> 8.6092715231788075E-2 | E18: 123 | F18: 1 | G18: 25 | H18: 29 | I18: 1 | J18: 179 | K18: 65 | L18: 3 | M18: 11 | N18: 15 | O18: 0 | P18: 94
A19: MARTINS B | B19: 2887 | C19: 422 | D19: =RC[-1]/RC[-2] -> 0.14617249740214755 | E19: 158 | F19: 1 | G19: 13 | H19: 57 | I19: 0 | J19: 229 | K19: 127 | L19: 1 | M19: 4 | N19: 61 | O19: 0 | P19: 193
A20: MARTINS C | B20: 2406 | C20: 451 | D20: =RC[-1]/RC[-2] -> 0.18744804655029093 | E20: 139 | F20: 3 | G20: 31 | H20: 24 | I20: 1 | J20: 198 | K20: 178 | L20: 9 | M20: 29 | N20: 37 | O20: 0 | P20: 253
A21: PINCKNEYVILLE A | B21: 2689 | C21: 278 | D21: =RC[-1]/RC[-2] -> 0.10338415767943473 | E21: 151 | F21: 1 | G21: 51 | H21: 5 | I21: 3 | J21: 211 | K21: 44 | L21: 0 | M21: 16 | N21: 6 | O21: 1 | P21: 67
A22: PINCKNEYVILLE B | B22: 3377 | C22: 297 | D22: =RC[-1]/RC[-2] -> 8.7947882736156349E-2 | E22: 127 | F22: 0 | G22: 89 | H22: 2 | I22: 1 | J22: 219 | K22: 37 | L22: 5 | M22: 35 | N22: 1 | O22: 0 | P22: 78
A23: PINCKNEYVILLE C | B23: 1867 | C23: 563 | D23: =RC[-1]/RC[-2] -> 0.3015532940546331 | E23: 222 | F23: 9 | G23: 39 | H23: 1 | I23: 2 | J23: 273 | K23: 244 | L23: 10 | M23: 32 | N23: 4 | O23: 0 | P23: 290
A24: PINCKNEYVILLE D | B24: 2119 | C24: 175 | D24: =RC[-1]/RC[-2] -> 8.2586125530910812E-2 | E24: 81 | F24: 2 | G24: 42 | H24: 5 | I24: 0 | J24: 130 | K24: 29 | L24: 0 | M24: 12 | N24: 4 | O24: 0 | P24: 45
A25: SUGAR HILL A | B25: 4147 | C25: 522 | D25: =RC[-1]/RC[-2] -> 0.12587412587412589 | E25: 118 | F25: 1 | G25: 39 | H25: 27 | I25: 1 | J25: 186 | K25: 242 | L25: 9 | M25: 65 | N25: 17 | O25: 3 | P25: 336
A26: SUGAR HILL B | B26: 5087 | C26: 714 | D26: =RC[-1]/RC[-2] -> 0.14035777471987418 | E26: 175 | F26: 3 | G26: 28 | H26: 44 | I26: 0 | J26: 250 | K26: 325 | L26: 12 | M26: 60 | N26: 66 | O26: 1 | P26: 464
A27: HOG MOUNTAIN A | B27: 4606 | C27: 659 | D27: =RC[-1]/RC[-2] -> 0.14307425097698653 | E27: 218 | F27: 3 | G27: 25 | H27: 59 | I27: 3 | J27: 308 | K27: 291 | L27: 3 | M27: 19 | N27: 38 | O27: 0 | P27: 351
A28: HOG MOUNTAIN B | B28: 4301 | C28: 961 | D28: =RC[-1]/RC[-2] -> 0.22343641013717741 | E28: 209 | F28: 6 | G28: 57 | H28: 68 | I28: 0 | J28: 340 | K28: 428 | L28: 6 | M28: 115 | N28: 72 | O28: 0 | P28: 621
A29: ROCKYCREEK A | B29: 5318 | C29: 974 | D29: =RC[-1]/RC[-2] -> 0.18315156073711922 | E29: 190 | F29: 0 | G29: 110 | H29: 24 | I29: 2 | J29: 326 | K29: 396 | L29: 6 | M29: 223 | N29: 23 | O29: 0 | P29: 648
A30: CATES B | B30: 1570 | C30: 391 | D30: =RC[-1]/RC[-2] -> 0.24904458598726115 | E30: 104 | F30: 2 | G30: 11 | H30: 30 | I30: 0 | J30: 147 | K30: 164 | L30: 6 | M30: 17 | N30: 57 | O30: 0 | P30: 244
A31: CATES C | B31: 2687 | C31: 500 | D31: =RC[-1]/RC[-2] -> 0.18608113137327875 | E31: 106 | F31: 0 | G31: 4 | H31: 75 | I31: 2 | J31: 187 | K31: 190 | L31: 11 | M31: 6 | N31: 104 | O31: 2 | P31: 313
A32: HOG MOUNTAIN D | B32: 2971 | C32: 501 | D32: =RC[-1]/RC[-2] -> 0.16863009087849209 | E32: 110 | F32: 6 | G32: 28 | H32: 38 | I32: 1 | J32: 183 | K32: 208 | L32: 5 | M32: 28 | N32: 76 | O32: 1 | P32: 318
A33: BERKSHIRE D | B33: 2766 | C33: 686 | D33: =RC[-1]/RC[-2] -> 0.24801156905278379 | E33: 204 | F33: 1 | G33: 108 | H33: 3 | I33: 1 | J33: 317 | K33: 239 | L33: 6 | M33: 106 | N33: 17 | O33: 1 | P33: 369
A34: BERKSHIRE E | B34: 1912 | C34: 589 | D34: =RC[-1]/RC[-2] -> 0.30805439330543932 | E34: 134 | F34: 5 | G34: 134 | H34: 8 | I34: 0 | J34: 281 | K34: 202 | L34: 4 | M34: 92 | N34: 9 | O34: 1 | P34: 308
A35: BERKSHIRE F | B35: 2092 | C35: 311 | D35: =RC[-1]/RC[-2] -> 0.14866156787762907 | E35: 105 | F35: 3 | G35: 42 | H35: 24 | I35: 0 | J35: 174 | K35: 109 | L35: 6 | M35: 15 | N35: 6 | O35: 1 | P35: 137
A36: CATES D | B36: 2691 | C36: 624 | D36: =RC[-1]/RC[-2] -> 0.2318840579710145 | E36: 141 | F36: 10 | G36: 19 | H36: 50 | I36: 0 | J36: 220 | K36: 290 | L36: 11 | M36: 22 | N36: 81 | O36: 0 | P36: 404
A37: 035 Cates D - 04 | B37: 600 | C37: 136 | D37: =RC[-1]/RC[-2] -> 0.22666666666666666 | E37: 40 | F37: 1 | G37: 6 | H37: 5 | I37: 0 | J37: 52 | K37: 59 | L37: 3 | M37: 8 | N37: 14 | O37: 0 | P37: 84
A38: CATES E | B38: 2828 | C38: 695 | D38: =RC[-1]/RC[-2] -> 0.24575671852899575 | E38: 200 | F38: 3 | G38: 56 | H38: 40 | I38: 1 | J38: 300 | K38: 262 | L38: 12 | M38: 62 | N38: 59 | O38: 0 | P38: 395
A39: PINCKNEYVILLE E | B39: 2316 | C39: 165 | D39: =RC[-1]/RC[-2] -> 7.1243523316062179E-2 | E39: 98 | F39: 2 | G39: 16 | H39: 2 | I39: 2 | J39: 120 | K39: 38 | L39: 0 | M39: 5 | N39: 2 | O39: 0 | P39: 45
A40: PINCKNEYVILLE F | B40: 2433 | C40: 227 | D40: =RC[-1]/RC[-2] -> 9.3300452116728314E-2 | E40: 112 | F40: 6 | G40: 35 | H40: 1 | I40: 1 | J40: 155 | K40: 48 | L40: 3 | M40: 19 | N40: 1 | O40: 1 | P40: 72
A41: DUNCANS D | B41: 6314 | C41: 942 | D41: =RC[-1]/RC[-2] -> 0.14919227114349065 | E41: 163 | F41: 2 | G41: 57 | H41: 20 | I41: 1 | J41: 243 | K41: 461 | L41: 21 | M41: 190 | N41: 24 | O41: 3 | P41: 699
A42: PINCKNEYVILLE H | B42: 4271 | C42: 946 | D42: =RC[-1]/RC[-2] -> 0.22149379536408334 | E42: 336 | F42: 9 | G42: 163 | H42: 17 | I42: 1 | J42: 526 | K42: 297 | L42: 12 | M42: 98 | N42: 11 | O42: 2 | P42: 420
A43: BAYCREEK B | B43: 5497 | C43: 819 | D43: =RC[-1]/RC[-2] -> 0.14899035837729671 | E43: 259 | F43: 2 | G43: 5 | H43: 110 | I43: 4 | J43: 380 | K43: 292 | L43: 2 | M43: 3 | N43: 139 | O43: 3 | P43: 439
A44: LAWRENCEVILLE C | B44: 2822 | C44: 504 | D44: =RC[-1]/RC[-2] -> 0.17859673990077959 | E44: 95 | F44: 0 | G44: 23 | H44: 43 | I44: 0 | J44: 161 | K44: 194 | L44: 11 | M44: 44 | N44: 93 | O44: 1 | P44: 343
A45: MARTINS D | B45: 2205 | C45: 199 | D45: =RC[-1]/RC[-2] -> 9.024943310657596E-2 | E45: 102 | F45: 6 | G45: 30 | H45: 20 | I45: 0 | J45: 158 | K45: 20 | L45: 1 | M45: 15 | N45: 5 | O45: 0 | P45: 41
A46: ROCKBRIDGE B | B46: 3871 | C46: 533 | D46: =RC[-1]/RC[-2] -> 0.13769051924567297 | E46: 194 | F46: 2 | G46: 14 | H46: 74 | I46: 2 | J46: 286 | K46: 165 | L46: 1 | M46: 14 | N46: 64 | O46: 3 | P46: 247
A47: GARNERS B | B47: 3007 | C47: 660 | D47: =RC[-1]/RC[-2] -> 0.21948786165613568 | E47: 194 | F47: 3 | G47: 101 | H47: 37 | I47: 2 | J47: 337 | K47: 170 | L47: 8 | M47: 104 | N47: 39 | O47: 2 | P47: 323
A48: CATES F | B48: 1713 | C48: 489 | D48: =RC[-1]/RC[-2] -> 0.28546409807355516 | E48: 83 | F48: 3 | G48: 7 | H48: 38 | I48: 0 | J48: 131 | K48: 271 | L48: 2 | M48: 7 | N48: 78 | O48: 0 | P48: 358
A49: CATES G | B49: 2664 | C49: 784 | D49: =RC[-1]/RC[-2] -> 0.29429429429429427 | E49: 162 | F49: 1 | G49: 15 | H49: 65 | I49: 0 | J49: 243 | K49: 377 | L49: 12 | M49: 18 | N49: 134 | O49: 0 | P49: 541
A50: DULUTH B | B50: 3432 | C50: 688 | D50: =RC[-1]/RC[-2] -> 0.20046620046620048 | E50: 170 | F50: 7 | G50: 140 | H50: 19 | I50: 0 | J50: 336 | K50: 230 | L50: 8 | M50: 99 | N50: 15 | O50: 0 | P50: 352
A51: GARNERS C | B51: 1961 | C51: 368 | D51: =RC[-1]/RC[-2] -> 0.18765935747067822 | E51: 90 | F51: 2 | G51: 52 | H51: 2 | I51: 1 | J51: 147 | K51: 130 | L51: 5 | M51: 76 | N51: 9 | O51: 1 | P51: 221
A52: PINCKNEYVILLE I | B52: 2580 | C52: 250 | D52: =RC[-1]/RC[-2] -> 9.6899224806201556E-2 | E52: 105 | F52: 3 | G52: 44 | H52: 2 | I52: 1 | J52: 155 | K52: 53 | L52: 0 | M52: 40 | N52: 1 | O52: 1 | P52: 95
A53: PINCKNEYVILLE J | B53: 2653 | C53: 210 | D53: =RC[-1]/RC[-2] -> 7.9155672823219003E-2 | E53: 105 | F53: 3 | G53: 60 | H53: 3 | I53: 0 | J53: 171 | K53: 25 | L53: 3 | M53: 11 | N53: 0 | O53: 0 | P53: 39
A54: BERKSHIRE G | B54: 2292 | C54: 617 | D54: =RC[-1]/RC[-2] -> 0.26919720767888305 | E54: 140 | F54: 1 | G54: 109 | H54: 7 | I54: 0 | J54: 257 | K54: 209 | L54: 7 | M54: 138 | N54: 6 | O54: 0 | P54: 360
A55: CATES H | B55: 3782 | C55: 594 | D55: =RC[-1]/RC[-2] -> 0.15705975674246431 | E55: 172 | F55: 3 | G55: 3 | H55: 100 | I55: 5 | J55: 283 | K55: 194 | L55: 13 | M55: 6 | N55: 98 | O55: 0 | P55: 311
A56: SUGAR HILL C | B56: 4750 | C56: 607 | D56: =RC[-1]/RC[-2] -> 0.12778947368421054 | E56: 134 | F56: 7 | G56: 20 | H56: 40 | I56: 3 | J56: 204 | K56: 309 | L56: 8 | M56: 30 | N56: 53 | O56: 3 | P56: 403
A57: SUGAR HILL D | B57: 4221 | C57: 582 | D57: =RC[-1]/RC[-2] -> 0.13788201847903339 | E57: 124 | F57: 6 | G57: 50 | H57: 16 | I57: 3 | J57: 199 | K57: 251 | L57: 3 | M57: 101 | N57: 21 | O57: 7 | P57: 383
A58: DULUTH C | B58: 2304 | C58: 478 | D58: =RC[-1]/RC[-2] -> 0.20746527777777779 | E58: 161 | F58: 2 | G58: 89 | H58: 5 | I58: 0 | J58: 257 | K58: 130 | L58: 12 | M58: 69 | N58: 9 | O58: 1 | P58: 221
A59: DULUTH D | B59: 4640 | C59: 732 | D59: =RC[-1]/RC[-2] -> 0.15775862068965518 | E59: 189 | F59: 8 | G59: 202 | H59: 28 | I59: 1 | J59: 428 | K59: 129 | L59: 4 | M59: 151 | N59: 19 | O59: 1 | P59: 304
A60: PINCKNEYVILLE K | B60: 3734 | C60: 331 | D60: =RC[-1]/RC[-2] -> 8.8644884841992497E-2 | E60: 162 | F60: 2 | G60: 51 | H60: 10 | I60: 0 | J60: 225 | K60: 85 | L60: 4 | M60: 12 | N60: 5 | O60: 0 | P60: 106
A61: PINCKNEYVILLE N | B61: 3940 | C61: 292 | D61: =RC[-1]/RC[-2] -> 7.4111675126903559E-2 | E61: 184 | F61: 2 | G61: 41 | H61: 7 | I61: 1 | J61: 235 | K61: 45 | L61: 0 | M61: 11 | N61: 1 | O61: 0 | P61: 57
A62: LAWRENCEVILLE D | B62: 5025 | C62: 412 | D62: =RC[-1]/RC[-2] -> 8.1990049751243785E-2 | E62: 119 | F62: 2 | G62: 11 | H62: 117 | I62: 1 | J62: 250 | K62: 70 | L62: 4 | M62: 3 | N62: 83 | O62: 2 | P62: 162
A63: LAWRENCEVILLE E | B63: 2255 | C63: 552 | D63: =RC[-1]/RC[-2] -> 0.24478935698447893 | E63: 117 | F63: 2 | G63: 5 | H63: 78 | I63: 0 | J63: 202 | K63: 183 | L63: 8 | M63: 5 | N63: 153 | O63: 1 | P63: 350
A64: PINCKNEYVILLE L | B64: 2264 | C64: 868 | D64: =RC[-1]/RC[-2] -> 0.3833922261484099 | E64: 226 | F64: 15 | G64: 62 | H64: 7 | I64: 0 | J64: 310 | K64: 429 | L64: 17 | M64: 102 | N64: 10 | O64: 0 | P64: 558
A65: PINCKNEYVILLE M | B65: 2566 | C65: 765 | D65: =RC[-1]/RC[-2] -> 0.29812938425565083 | E65: 198 | F65: 23 | G65: 51 | H65: 9 | I65: 0 | J65: 281 | K65: 381 | L65: 20 | M65: 74 | N65: 9 | O65: 0 | P65: 484
A66: GARNERS D | B66: 3250 | C66: 589 | D66: =RC[-1]/RC[-2] -> 0.18123076923076922 | E66: 223 | F66: 8 | G66: 105 | H66: 27 | I66: 1 | J66: 364 | K66: 137 | L66: 4 | M66: 61 | N66: 23 | O66: 0 | P66: 225
A67: BERKSHIRE H | B67: 1797 | C67: 246 | D67: =RC[-1]/RC[-2] -> 0.13689482470784642 | E67: 78 | F67: 0 | G67: 47 | H67: 3 | I67: 0 | J67: 128 | K67: 66 | L67: 4 | M67: 45 | N67: 3 | O67: 0 | P67: 118
A68: PINCKNEYVILLE O | B68: 3406 | C68: 358 | D68: =RC[-1]/RC[-2] -> 0.10510863182618908 | E68: 145 | F68: 1 | G68: 122 | H68: 4 | I68: 0 | J68: 272 | K68: 46 | L68: 1 | M68: 37 | N68: 2 | O68: 0 | P68: 86
A69: PUCKETTS E | B69: 5012 | C69: 692 | D69: =RC[-1]/RC[-2] -> 0.13806863527533919 | E69: 128 | F69: 3 | G69: 98 | H69: 18 | I69: 2 | J69: 249 | K69: 227 | L69: 5 | M69: 183 | N69: 27 | O69: 1 | P69: 443
A70: CATES I | B70: 3451 | C70: 745 | D70: =RC[-1]/RC[-2] -> 0.215879455230368 | E70: 195 | F70: 2 | G70: 21 | H70: 70 | I70: 0 | J70: 288 | K70: 331 | L70: 7 | M70: 32 | N70: 87 | O70: 0 | P70: 457
A71: CATES J | B71: 3345 | C71: 671 | D71: =RC[-1]/RC[-2] -> 0.20059790732436472 | E71: 217 | F71: 0 | G71: 73 | H71: 24 | I71: 1 | J71: 315 | K71: 250 | L71: 15 | M71: 67 | N71: 24 | O71: 0 | P71: 356
A72: GOODWINS B | B72: 3686 | C72: 827 | D72: =RC[-1]/RC[-2] -> 0.22436245252306022 | E72: 236 | F72: 6 | G72: 24 | H72: 92 | I72: 0 | J72: 358 | K72: 351 | L72: 11 | M72: 32 | N72: 75 | O72: 0 | P72: 469
A73: LAWRENCEVILLE F | B73: 3780 | C73: 526 | D73: =RC[-1]/RC[-2] -> 0.13915343915343914 | E73: 135 | F73: 2 | G73: 11 | H73: 171 | I73: 1 | J73: 320 | K73: 84 | L73: 1 | M73: 5 | N73: 116 | O73: 0 | P73: 206
A74: MARTINS E | B74: 6301 | C74: 310 | D74: =RC[-1]/RC[-2] -> 4.9198539914299316E-2 | E74: 147 | F74: 5 | G74: 72 | H74: 34 | I74: 1 | J74: 259 | K74: 31 | L74: 0 | M74: 13 | N74: 7 | O74: 0 | P74: 51
A75: PINCKNEYVILLE P | B75: 2150 | C75: 484 | D75: =RC[-1]/RC[-2] -> 0.22511627906976744 | E75: 209 | F75: 11 | G75: 28 | H75: 6 | I75: 0 | J75: 254 | K75: 196 | L75: 7 | M75: 24 | N75: 3 | O75: 0 | P75: 230
A76: PINCKNEYVILLE Q | B76: 1805 | C76: 202 | D76: =RC[-1]/RC[-2] -> 0.11191135734072022 | E76: 113 | F76: 0 | G76: 31 | H76: 9 | I76: 1 | J76: 154 | K76: 43 | L76: 0 | M76: 5 | N76: 0 | O76: 0 | P76: 48
A77: ROCKBRIDGE C | B77: 4841 | C77: 914 | D77: =RC[-1]/RC[-2] -> 0.18880396612270192 | E77: 348 | F77: 5 | G77: 24 | H77: 158 | I77: 6 | J77: 541 | K77: 246 | L77: 8 | M77: 18 | N77: 101 | O77: 0 | P77: 373
A78: ROCKBRIDGE D | B78: 3477 | C78: 632 | D78: =RC[-1]/RC[-2] -> 0.181765890135174 | E78: 211 | F78: 6 | G78: 4 | H78: 108 | I78: 2 | J78: 331 | K78: 183 | L78: 3 | M78: 4 | N78: 107 | O78: 4 | P78: 301
A79: GOODWINS C | B79: 5336 | C79: 723 | D79: =RC[-1]/RC[-2] -> 0.13549475262368815 | E79: 233 | F79: 10 | G79: 30 | H79: 121 | I79: 0 | J79: 394 | K79: 255 | L79: 3 | M79: 10 | N79: 61 | O79: 0 | P79: 329
A80: BAYCREEK K | B80: 3597 | C80: 739 | D80: =RC[-1]/RC[-2] -> 0.20544898526549904 | E80: 151 | F80: 4 | G80: 4 | H80: 133 | I80: 1 | J80: 293 | K80: 268 | L80: 8 | M80: 8 | N80: 162 | O80: 0 | P80: 446
A81: CATES K | B81: 2610 | C81: 617 | D81: =RC[-1]/RC[-2] -> 0.2363984674329502 | E81: 175 | F81: 3 | G81: 12 | H81: 61 | I81: 0 | J81: 251 | K81: 268 | L81: 0 | M81: 17 | N81: 79 | O81: 2 | P81: 366
A82: BAYCREEK C | B82: 5931 | C82: 1121 | D82: =RC[-1]/RC[-2] -> 0.18900691283088855 | E82: 290 | F82: 3 | G82: 10 | H82: 208 | I82: 1 | J82: 512 | K82: 324 | L82: 18 | M82: 19 | N82: 248 | O82: 0 | P82: 609
A83: CATES L | B83: 3873 | C83: 775 | D83: =RC[-1]/RC[-2] -> 0.20010327911179965 | E83: 218 | F83: 1 | G83: 3 | H83: 86 | I83: 0 | J83: 308 | K83: 310 | L83: 9 | M83: 9 | N83: 139 | O83: 0 | P83: 467
A84: DULUTH E | B84: 4766 | C84: 650 | D84: =RC[-1]/RC[-2] -> 0.13638271086865295 | E84: 248 | F84: 4 | G84: 168 | H84: 10 | I84: 0 | J84: 430 | K84: 144 | L84: 4 | M84: 62 | N84: 10 | O84: 0 | P84: 220
A85: GOODWINS D | B85: 4098 | C85: 686 | D85: =RC[-1]/RC[-2] -> 0.16739873108833578 | E85: 210 | F85: 4 | G85: 11 | H85: 66 | I85: 0 | J85: 291 | K85: 303 | L85: 8 | M85: 6 | N85: 78 | O85: 0 | P85: 395
A86: LAWRENCEVILLE G | B86: 2879 | C86: 397 | D86: =RC[-1]/RC[-2] -> 0.13789510246613407 | E86: 152 | F86: 0 | G86: 6 | H86: 69 | I86: 0 | J86: 227 | K86: 107 | L86: 0 | M86: 3 | N86: 59 | O86: 1 | P86: 170
A87: LAWRENCEVILLE H | B87: 4023 | C87: 769 | D87: =RC[-1]/RC[-2] -> 0.19115088242605022 | E87: 185 | F87: 5 | G87: 15 | H87: 111 | I87: 1 | J87: 317 | K87: 297 | L87: 8 | M87: 24 | N87: 123 | O87: 0 | P87: 452
A88: MARTINS F | B88: 2498 | C88: 220 | D88: =RC[-1]/RC[-2] -> 8.8070456365092073E-2 | E88: 81 | F88: 0 | G88: 46 | H88: 13 | I88: 0 | J88: 140 | K88: 63 | L88: 2 | M88: 8 | N88: 7 | O88: 0 | P88: 80
A89: PINCKNEYVILLE S | B89: 3162 | C89: 486 | D89: =RC[-1]/RC[-2] -> 0.15370018975332067 | E89: 184 | F89: 3 | G89: 97 | H89: 11 | I89: 1 | J89: 296 | K89: 135 | L89: 9 | M89: 39 | N89: 5 | O89: 2 | P89: 190
A90: ROCKBRIDGE E | B90: 4360 | C90: 646 | D90: =RC[-1]/RC[-2] -> 0.14816513761467889 | E90: 247 | F90: 1 | G90: 11 | H90: 82 | I90: 9 | J90: 350 | K90: 224 | L90: 4 | M90: 12 | N90: 55 | O90: 1 | P90: 296
A91: SUGAR HILL E | B91: 3162 | C91: 470 | D91: =RC[-1]/RC[-2] -> 0.14864010120177104 | E91: 119 | F91: 2 | G91: 20 | H91: 53 | I91: 1 | J91: 195 | K91: 160 | L91: 5 | M91: 27 | N91: 82 | O91: 1 | P91: 275
A92: LAWRENCEVILLE I | B92: 3212 | C92: 464 | D92: =RC[-1]/RC[-2] -> 0.14445828144458281 | E92: 170 | F92: 3 | G92: 6 | H92: 76 | I92: 0 | J92: 255 | K92: 126 | L92: 5 | M92: 9 | N92: 66 | O92: 3 | P92: 209
A93: BAYCREEK D | B93: 4292 | C93: 883 | D93: =RC[-1]/RC[-2] -> 0.20573159366262814 | E93: 190 | F93: 1 | G93: 2 | H93: 124 | I93: 2 | J93: 319 | K93: 341 | L93: 10 | M93: 13 | N93: 200 | O93: 0 | P93: 564
A94: BERKSHIRE J | B94: 2621 | C94: 807 | D94: =RC[-1]/RC[-2] -> 0.30789774895078215 | E94: 190 | F94: 3 | G94: 134 | H94: 8 | I94: 1 | J94: 336 | K94: 296 | L94: 7 | M94: 155 | N94: 12 | O94: 1 | P94: 471
A95: CATES M | B95: 3853 | C95: 908 | D95: =RC[-1]/RC[-2] -> 0.23566052426680509 | E95: 208 | F95: 9 | G95: 21 | H95: 99 | I95: 0 | J95: 337 | K95: 345 | L95: 21 | M95: 23 | N95: 177 | O95: 5 | P95: 571
A96: CATES N | B96: 2502 | C96: 639 | D96: =RC[-1]/RC[-2] -> 0.25539568345323743 | E96: 86 | F96: 3 | G96: 0 | H96: 60 | I96: 2 | J96: 151 | K96: 302 | L96: 4 | M96: 15 | N96: 166 | O96: 1 | P96: 488
A97: DULUTH F | B97: 5695 | C97: 398 | D97: =RC[-1]/RC[-2] -> 6.988586479367867E-2 | E97: 184 | F97: 3 | G97: 61 | H97: 47 | I97: 2 | J97: 297 | K97: 66 | L97: 2 | M97: 22 | N97: 11 | O97: 0 | P97: 101
A98: DULUTH G | B98: 2857 | C98: 638 | D98: =RC[-1]/RC[-2] -> 0.2233111655582779 | E98: 192 | F98: 9 | G98: 52 | H98: 31 | I98: 2 | J98: 286 | K98: 258 | L98: 5 | M98: 39 | N98: 50 | O98: 0 | P98: 352
A99: GOODWINS E | B99: 5111 | C99: 864 | D99: =RC[-1]/RC[-2] -> 0.16904715319898259 | E99: 274 | F99: 6 | G99: 14 | H99: 135 | I99: 1 | J99: 430 | K99: 302 | L99: 6 | M99: 15 | N99: 110 | O99: 1 | P99: 434
A100: GOODWINS F | B100: 2998 | C100: 463 | D100: =RC[-1]/RC[-2] -> 0.15443629086057373 | E100: 162 | F100: 3 | G100: 16 | H100: 69 | I100: 1 | J100: 251 | K100: 139 | L100: 4 | M100: 3 | N100: 66 | O100: 0 | P100: 212
A101: PINCKNEYVILLE T | B101: 2966 | C101: 492 | D101: =RC[-1]/RC[-2] -> 0.16587997302764665 | E101: 163 | F101: 3 | G101: 101 | H101: 9 | I101: 0 | J101: 276 | K101: 155 | L101: 4 | M101: 51 | N101: 6 | O101: 0 | P101: 216
A102: SUWANEE B | B102: 4217 | C102: 801 | D102: =RC[-1]/RC[-2] -> 0.18994545885700734 | E102: 146 | F102: 3 | G102: 2 | H102: 230 | I102: 0 | J102: 381 | K102: 185 | L102: 6 | M102: 5 | N102: 224 | O102: 0 | P102: 420
A103: PINCKNEYVILLE U | B103: 2108 | C103: 419 | D103: =RC[-1]/RC[-2] -> 0.19876660341555977 | E103: 188 | F103: 2 | G103: 28 | H103: 4 | I103: 0 | J103: 222 | K103: 171 | L103: 8 | M103: 13 | N103: 5 | O103: 0 | P103: 197
A104: PUCKETTS B | B104: 2815 | C104: 596 | D104: =RC[-1]/RC[-2] -> 0.21172291296625223 | E104: 72 | F104: 1 | G104: 96 | H104: 2 | I104: 2 | J104: 173 | K104: 202 | L104: 13 | M104: 186 | N104: 20 | O104: 2 | P104: 423
A105: BERKSHIRE L | B105: 3073 | C105: 388 | D105: =RC[-1]/RC[-2] -> 0.12626098275301009 | E105: 167 | F105: 5 | G105: 43 | H105: 27 | I105: 1 | J105: 243 | K105: 105 | L105: 6 | M105: 24 | N105: 10 | O105: 0 | P105: 145
A106: ROCKBRIDGE F | B106: 5486 | C106: 929 | D106: =RC[-1]/RC[-2] -> 0.16934013853445132 | E106: 271 | F106: 1 | G106: 6 | H106: 226 | I106: 1 | J106: 505 | K106: 207 | L106: 9 | M106: 2 | N106: 205 | O106: 1 | P106: 424
A107: SUGAR HILL F | B107: 3801 | C107: 585 | D107: =RC[-1]/RC[-2] -> 0.15390686661404893 | E107: 133 | F107: 3 | G107: 8 | H107: 70 | I107: 0 | J107: 214 | K107: 273 | L107: 3 | M107: 13 | N107: 78 | O107: 4 | P107: 371
A108: SUWANEE C | B108: 5028 | C108: 815 | D108: =RC[-1]/RC[-2] -> 0.1620922832140016 | E108: 213 | F108: 10 | G108: 12 | H108: 137 | I108: 3 | J108: 375 | K108: 277 | L108: 7 | M108: 6 | N108: 147 | O108: 3 | P108: 440
A109: CATES O | B109: 1377 | C109: 319 | D109: =RC[-1]/RC[-2] -> 0.23166303558460422 | E109: 56 | F109: 1 | G109: 19 | H109: 19 | I109: 1 | J109: 96 | K109: 168 | L109: 4 | M109: 29 | N109: 22 | O109: 0 | P109: 223
A110: BAYCREEK E | B110: 2949 | C110: 449 | D110: =RC[-1]/RC[-2] -> 0.15225500169549 | E110: 117 | F110: 0 | G110: 5 | H110: 65 | I110: 0 | J110: 187 | K110: 175 | L110: 4 | M110: 8 | N110: 74 | O110: 1 | P110: 262
A111: BERKSHIRE M | B111: 1681 | C111: 443 | D111: =RC[-1]/RC[-2] -> 0.26353361094586558 | E111: 123 | F111: 0 | G111: 56 | H111: 5 | I111: 0 | J111: 184 | K111: 183 | L111: 4 | M111: 61 | N111: 11 | O111: 0 | P111: 259
A112: MARTINS G | B112: 2263 | C112: 264 | D112: =RC[-1]/RC[-2] -> 0.11665930181175431 | E112: 93 | F112: 1 | G112: 7 | H112: 51 | I112: 0 | J112: 152 | K112: 76 | L112: 3 | M112: 1 | N112: 32 | O112: 0 | P112: 112
A113: DULUTH H | B113: 2725 | C113: 448 | D113: =RC[-1]/RC[-2] -> 0.16440366972477063 | E113: 140 | F113: 3 | G113: 91 | H113: 22 | I113: 1 | J113: 257 | K113: 113 | L113: 6 | M113: 56 | N113: 16 | O113: 0 | P113: 191
A114: BERKSHIRE N | B114: 2902 | C114: 928 | D114: =RC[-1]/RC[-2] -> 0.31977946243969674 | E114: 166 | F114: 5 | G114: 188 | H114: 9 | I114: 1 | J114: 369 | K114: 246 | L114: 11 | M114: 286 | N114: 16 | O114: 0 | P114: 559
A115: PINCKNEYVILLE V | B115: 1636 | C115: 248 | D115: =RC[-1]/RC[-2] -> 0.15158924205378974 | E115: 88 | F115: 2 | G115: 69 | H115: 1 | I115: 1 | J115: 161 | K115: 52 | L115: 0 | M115: 31 | N115: 4 | O115: 0 | P115: 87
A116: PINCKNEYVILLE W | B116: 4000 | C116: 740 | D116: =RC[-1]/RC[-2] -> 0.185 | E116: 293 | F116: 7 | G116: 144 | H116: 11 | I116: 5 | J116: 460 | K116: 201 | L116: 4 | M116: 65 | N116: 9 | O116: 1 | P116: 280
A117: MARTINS H | B117: 4682 | C117: 581 | D117: =RC[-1]/RC[-2] -> 0.12409226826142675 | E117: 203 | F117: 5 | G117: 19 | H117: 82 | I117: 2 | J117: 311 | K117: 156 | L117: 10 | M117: 9 | N117: 95 | O117: 0 | P117: 270
A118: MARTINS I | B118: 3648 | C118: 333 | D118: =RC[-1]/RC[-2] -> 9.1282894736842105E-2 | E118: 145 | F118: 4 | G118: 31 | H118: 43 | I118: 0 | J118: 223 | K118: 80 | L118: 2 | M118: 16 | N118: 12 | O118: 0 | P118: 110
A119: MARTINS J | B119: 3981 | C119: 331 | D119: =RC[-1]/RC[-2] -> 8.3144938457673956E-2 | E119: 151 | F119: 1 | G119: 31 | H119: 48 | I119: 2 | J119: 233 | K119: 70 | L119: 2 | M119: 9 | N119: 17 | O119: 0 | P119: 98
A120: GARNERS F | B120: 1621 | C120: 397 | D120: =RC[-1]/RC[-2] -> 0.24491054904380014 | E120: 72 | F120: 0 | G120: 71 | H120: 3 | I120: 0 | J120: 146 | K120: 144 | L120: 6 | M120: 100 | N120: 1 | O120: 0 | P120: 251
A121: BERKSHIRE O | B121: 2454 | C121: 620 | D121: =RC[-1]/RC[-2] -> 0.25264873675631622 | E121: 170 | F121: 2 | G121: 61 | H121: 18 | I121: 0 | J121: 251 | K121: 262 | L121: 13 | M121: 75 | N121: 19 | O121: 0 | P121: 369
A122: BERKSHIRE P | B122: 1364 | C122: 195 | D122: =RC[-1]/RC[-2] -> 0.14296187683284459 | E122: 63 | F122: 1 | G122: 20 | H122: 10 | I122: 0 | J122: 94 | K122: 69 | L122: 0 | M122: 18 | N122: 14 | O122: 0 | P122: 101
A123: PINCKNEYVILLE X | B123: 3272 | C123: 791 | D123: =RC[-1]/RC[-2] -> 0.2417481662591687 | E123: 211 | F123: 19 | G123: 130 | H123: 12 | I123: 0 | J123: 372 | K123: 262 | L123: 23 | M123: 126 | N123: 8 | O123: 0 | P123: 419
A124: ROCKBRIDGE G | B124: 5420 | C124: 802 | D124: =RC[-1]/RC[-2] -> 0.14797047970479704 | E124: 272 | F124: 6 | G124: 17 | H124: 184 | I124: 6 | J124: 485 | K124: 144 | L124: 6 | M124: 14 | N124: 145 | O124: 8 | P124: 317
A125: PINCKNEYVILLE Y | B125: 3161 | C125: 279 | D125: =RC[-1]/RC[-2] -> 8.8263207845618474E-2 | E125: 152 | F125: 4 | G125: 57 | H125: 4 | I125: 1 | J125: 218 | K125: 51 | L125: 0 | M125: 10 | N125: 0 | O125: 0 | P125: 61
A126: GOODWINS G | B126: 2491 | C126: 308 | D126: =RC[-1]/RC[-2] -> 0.12364512244078683 | E126: 129 | F126: 1 | G126: 9 | H126: 39 | I126: 0 | J126: 178 | K126: 92 | L126: 3 | M126: 4 | N126: 31 | O126: 0 | P126: 130
A127: PINCKNEYVILLE Z | B127: 1835 | C127: 678 | D127: =RC[-1]/RC[-2] -> 0.36948228882833789 | E127: 179 | F127: 9 | G127: 46 | H127: 2 | I127: 0 | J127: 236 | K127: 387 | L127: 5 | M127: 49 | N127: 1 | O127: 0 | P127: 442
A128: PINCKNEYVILLE A1 | B128: 2651 | C128: 758 | D128: =RC[-1]/RC[-2] -> 0.28592983779705772 | E128: 279 | F128: 10 | G128: 58 | H128: 8 | I128: 0 | J128: 355 | K128: 334 | L128: 14 | M128: 47 | N128: 8 | O128: 0 | P128: 403
A129: LAWRENCEVILLE J | B129: 2046 | C129: 325 | D129: =RC[-1]/RC[-2] -> 0.15884652981427175 | E129: 106 | F129: 4 | G129: 3 | H129: 65 | I129: 1 | J129: 179 | K129: 111 | L129: 2 | M129: 2 | N129: 30 | O129: 1 | P129: 146
A130: GOODWINS H | B130: 2610 | C130: 471 | D130: =RC[-1]/RC[-2] -> 0.18045977011494252 | E130: 165 | F130: 2 | G130: 9 | H130: 73 | I130: 3 | J130: 252 | K130: 163 | L130: 0 | M130: 2 | N130: 51 | O130: 3 | P130: 219
A131: DUNCANS B | B131: 4820 | C131: 779 | D131: =RC[-1]/RC[-2] -> 0.1616182572614108 | E131: 142 | F131: 5 | G131: 47 | H131: 9 | I131: 0 | J131: 203 | K131: 380 | L131: 13 | M131: 159 | N131: 24 | O131: 0 | P131: 576
A132: SUWANEE D | B132: 4389 | C132: 676 | D132: =RC[-1]/RC[-2] -> 0.15402141717931192 | E132: 183 | F132: 2 | G132: 4 | H132: 90 | I132: 3 | J132: 282 | K132: 279 | L132: 9 | M132: 5 | N132: 98 | O132: 3 | P132: 394
A133: SUWANEE E | B133: 3993 | C133: 774 | D133: =RC[-1]/RC[-2] -> 0.19383921863260706 | E133: 163 | F133: 7 | G133: 0 | H133: 165 | I133: 2 | J133: 337 | K133: 271 | L133: 7 | M133: 1 | N133: 155 | O133: 3 | P133: 437
A134: LAWRENCEVILLE K | B134: 3029 | C134: 600 | D134: =RC[-1]/RC[-2] -> 0.19808517662594916 | E134: 175 | F134: 0 | G134: 18 | H134: 75 | I134: 0 | J134: 268 | K134: 218 | L134: 7 | M134: 22 | N134: 85 | O134: 0 | P134: 332
A135: HARBINS B | B135: 4367 | C135: 764 | D135: =RC[-1]/RC[-2] -> 0.17494847721547974 | E135: 118 | F135: 2 | G135: 76 | H135: 28 | I135: 0 | J135: 224 | K135: 275 | L135: 3 | M135: 229 | N135: 30 | O135: 3 | P135: 540
A136: BAYCREEK F | B136: 4278 | C136: 778 | D136: =RC[-1]/RC[-2] -> 0.18186068256194485 | E136: 241 | F136: 1 | G136: 6 | H136: 107 | I136: 0 | J136: 355 | K136: 291 | L136: 9 | M136: 6 | N136: 117 | O136: 0 | P136: 423
A137: PUCKETTS C | B137: 3018 | C137: 485 | D137: =RC[-1]/RC[-2] -> 0.16070245195493704 | E137: 89 | F137: 2 | G137: 42 | H137: 5 | I137: 3 | J137: 141 | K137: 208 | L137: 5 | M137: 118 | N137: 12 | O137: 1 | P137: 344
A138: HOG MOUNTAIN C | B138: 3958 | C138: 624 | D138: =RC[-1]/RC[-2] -> 0.15765538150581102 | E138: 125 | F138: 3 | G138: 30 | H138: 28 | I138: 1 | J138: 187 | K138: 301 | L138: 6 | M138: 80 | N138: 49 | O138: 1 | P138: 437
A139: ROCKYCREEK B | B139: 4780 | C139: 726 | D139: =RC[-1]/RC[-2] -> 0.15188284518828452 | E139: 133 | F139: 1 | G139: 71 | H139: 27 | I139: 3 | J139: 235 | K139: 277 | L139: 14 | M139: 151 | N139: 42 | O139: 7 | P139: 491
A140: DULUTH I | B140: 4610 | C140: 803 | D140: =RC[-1]/RC[-2] -> 0.17418655097613883 | E140: 246 | F140: 10 | G140: 84 | H140: 73 | I140: 2 | J140: 415 | K140: 253 | L140: 11 | M140: 48 | N140: 75 | O140: 1 | P140: 388
A141: MARTINS K | B141: 4976 | C141: 582 | D141: =RC[-1]/RC[-2] -> 0.11696141479099678 | E141: 253 | F141: 4 | G141: 22 | H141: 79 | I141: 3 | J141: 361 | K141: 160 | L141: 4 | M141: 13 | N141: 44 | O141: 0 | P141: 221
A142: SUWANEE H | B142: 3593 | C142: 672 | D142: =RC[-1]/RC[-2] -> 0.18703033676593375 | E142: 156 | F142: 7 | G142: 5 | H142: 94 | I142: 1 | J142: 263 | K142: 266 | L142: 5 | M142: 4 | N142: 133 | O142: 1 | P142: 409
A143: SUGAR HILL G | B143: 2685 | C143: 541 | D143: =RC[-1]/RC[-2] -> 0.20148975791433893 | E143: 112 | F143: 3 | G143: 10 | H143: 50 | I143: 2 | J143: 177 | K143: 251 | L143: 6 | M143: 19 | N143: 88 | O143: 0 | P143: 364
A144: SUWANEE F | B144: 3701 | C144: 620 | D144: =RC[-1]/RC[-2] -> 0.16752229127262902 | E144: 176 | F144: 3 | G144: 12 | H144: 125 | I144: 2 | J144: 318 | K144: 210 | L144: 3 | M144: 3 | N144: 85 | O144: 1 | P144: 302
A145: LAWRENCEVILLE L | B145: 4474 | C145: 885 | D145: =RC[-1]/RC[-2] -> 0.19780956638354941 | E145: 264 | F145: 4 | G145: 5 | H145: 152 | I145: 0 | J145: 425 | K145: 279 | L145: 7 | M145: 9 | N145: 165 | O145: 0 | P145: 460
A146: LAWRENCEVILLE M | B146: 6275 | C146: 730 | D146: =RC[-1]/RC[-2] -> 0.11633466135458168 | E146: 270 | F146: 1 | G146: 15 | H146: 184 | I146: 1 | J146: 471 | K146: 149 | L146: 3 | M146: 15 | N146: 91 | O146: 1 | P146: 259
A147: BAYCREEK G | B147: 5337 | C147: 701 | D147: =RC[-1]/RC[-2] -> 0.13134719880082443 | E147: 179 | F147: 1 | G147: 5 | H147: 118 | I147: 0 | J147: 303 | K147: 265 | L147: 10 | M147: 10 | N147: 113 | O147: 0 | P147: 398
A148: BAYCREEK H | B148: 5888 | C148: 1129 | D148: =RC[-1]/RC[-2] -> 0.19174592391304349 | E148: 246 | F148: 3 | G148: 7 | H148: 127 | I148: 4 | J148: 387 | K148: 506 | L148: 16 | M148: 6 | N148: 211 | O148: 3 | P148: 742
A149: BAYCREEK I | B149: 5314 | C149: 872 | D149: =RC[-1]/RC[-2] -> 0.16409484380880693 | E149: 194 | F149: 3 | G149: 7 | H149: 202 | I149: 2 | J149: 408 | K149: 224 | L149: 7 | M149: 12 | N149: 219 | O149: 2 | P149: 464
A150: BERKSHIRE Q | B150: 1683 | C150: 396 | D150: =RC[-1]/RC[-2] -> 0.23529411764705882 | E150: 89 | F150: 0 | G150: 73 | H150: 6 | I150: 1 | J150: 169 | K150: 145 | L150: 5 | M150: 68 | N150: 7 | O150: 2 | P150: 227
A151: GOODWINS I | B151: 2379 | C151: 599 | D151: =RC[-1]/RC[-2] -> 0.25178646490121898 | E151: 209 | F151: 3 | G151: 15 | H151: 70 | I151: 0 | J151: 297 | K151: 237 | L151: 5 | M151: 4 | N151: 56 | O151: 0 | P151: 302
A152: DULUTH K | B152: 2832 | C152: 225 | D152: =RC[-1]/RC[-2] -> 7.9449152542372878E-2 | E152: 91 | F152: 3 | G152: 57 | H152: 7 | I152: 1 | J152: 159 | K152: 40 | L152: 0 | M152: 25 | N152: 1 | O152: 0 | P152: 66
A153: HARBINS C | B153: 2449 | C153: 438 | D153: =RC[-1]/RC[-2] -> 0.17884850959575338 | E153: 75 | F153: 0 | G153: 18 | H153: 11 | I153: 0 | J153: 104 | K153: 257 | L153: 7 | M153: 21 | N153: 48 | O153: 1 | P153: 334
A154: ROCKYCREEK C | B154: 4604 | C154: 867 | D154: =RC[-1]/RC[-2] -> 0.18831450912250217 | E154: 214 | F154: 2 | G154: 95 | H154: 26 | I154: 1 | J154: 338 | K154: 341 | L154: 3 | M154: 155 | N154: 30 | O154: 0 | P154: 529
A155: LAWRENCEVILLE N | B155: 2396 | C155: 375 | D155: =RC[-1]/RC[-2] -> 0.15651085141903173 | E155: 90 | F155: 2 | G155: 5 | H155: 76 | I155: 0 | J155: 173 | K155: 144 | L155: 5 | M155: 1 | N155: 52 | O155: 0 | P155: 202
A156: PUCKETTS D | B156: 3268 | C156: 586 | D156: =RC[-1]/RC[-2] -> 0.17931456548347613 | E156: 74 | F156: 5 | G156: 65 | H156: 7 | I156: 3 | J156: 154 | K156: 202 | L156: 10 | M156: 183 | N156: 34 | O156: 3 | P156: 432
A157: SUWANEE G | B157: 3622 | C157: 589 | D157: =RC[-1]/RC[-2] -> 0.16261733848702375 | E157: 205 | F157: 3 | G157: 3 | H157: 91 | I157: 2 | J157: 304 | K157: 228 | L157: 0 | M157: 6 | N157: 50 | O157: 1 | P157: 285
A158: BAYCREEK J | B158: 4164 | C158: 771 | D158: =RC[-1]/RC[-2] -> 0.18515850144092219 | E158: 239 | F158: 2 | G158: 8 | H158: 91 | I158: 2 | J158: 342 | K158: 289 | L158: 10 | M158: 7 | N158: 120 | O158: 3 | P158: 429